就活,ES,TEACH,こちらこそよろしくお願いします！実はまだ全然就活について考えたことがないので知らないことが多いのですが(笑)大まかな就活のスケジュールってどんな感じなんですか？◯年の◯月頃にエントリーシートを書いて〜とか、大まかにでいいので教えていただけると助かります！！
仕事,xxx,xxx,ありがとうございます。 もう少し視野を広げて中小も見てみようと思います。 ・業務の幅が広いこと(ジョブローテーション) ・福利厚生がしっかりしていること(制度を利用できる環境があること) の２つが重要だと考えています。 「働き方」とはこのようなことでいいでしょうか。
企業,企業研究,WHAT,企業を絞る方法でなにか良い手はありますでしょうか？
企業,軸,TEACH,エントリーシートの質問です 『企業や仕事を選択する上で、あなたが大事にしている価値観や軸について記述してください。また、企業のどのような部分を見て、自分の価値観や軸にあってると思うか教えてください』という質問にたいして、軸を述べたあとその企業のどことあうということを記述すればいいのですかね？
企業,軸,HOW,就活の軸ってよく耳にするんですけど、具体的にどういったものですか？ 見つけ方、軸による業界、企業の選び方など教えていただきたいです
仕事,自己分析,TEACH,"ありがとうございます！ 現段階では「やりがいの実感」のほうが、自分が必要とされていることを肌で感じ取れそうですね。  自分に合った仕事を探すのにおすすめの本やサイトがあれば教えてい"
xxx,軸,xxx,軸がないので、それを伺いたくてご連絡させて頂きました
仕事,軸,xxx,ありがとうございます！ところで仕事を選ぶ軸に関してお話はしてますでしょうか？
xxx,軸,xxx,自己分析とおそらく軸の探索ですね
自分,逆質問,WHAT,最近面接をしていて質問があります集団面接でも、個人面接でも、「最後に何か質問はありますか？」と問われますが、ここでは何か無理矢理にでも質問したほうがいいのでしょうか。面接に行くくらいですから、その企業のことは情報収集してありますし、そこまで質問する内容が思い浮かばないので、私はいつも「大丈夫です」と答えているのですが…。
xxx,面接,xxx,"では、一つお聞きしたいのが 面接の最後に逆質問があった場合どのような質問が適切か知りたいです。"
企業,逆質問,xxx,ドラッグストア業界を志望しているのですが、差別化が難しい業界のように感じて、企業選びが難航していますどんな情報をどのように集めればよいのでしょうかすごく漠然とした質問で申し訳ありません…
